{
    "date": "2024-10-13T09:18:37.191Z",
    "gamertag": "alanchatt123",
    "gamername": "Alan Chatt",
    "name": "Power Shot",
    "description": "Score a goal using the power shot mechanic",
    "icon": "http://images-eds.xboxlive.com/image?url=27S1DHqE.cHkmFg4nspsdwPTnSdXfPpBspCOeUi8nKgMFKeuOeoopokmcqpfijIk8ewqrb6KzKRUQ8aZ75QghPGNkpZlqr5xu0YNJmxunxBnm34IoeUxSNF9fcf3Izlr",
    "contentname": "EA SPORTS FCâ„¢ 25 Xbox Series X|S",
    "contentimage": "http://store-images.s-microsoft.com/image/apps.19344.13738418562228928.2f1b7c14-3e99-4a31-8375-ffc682a65cb0.2b4e09e5-281d-4184-9cf6-70277a5a54b5",
    "platform": "XboxOne",
    "gamerscore": 15,
    "rarityscore": 47,
    "raritycategory": "Common"
}